{
  "compatibility": {
    "minimum_loader_version": "1.6.1",
    "runtime_report_schema_version": 1
  },
  "components": [
    {
      "deployed_path": "mu-plugins/mrn-active-style-guide",
      "file_count": 9,
      "name": "MRN Active Style Guide",
      "required": true,
      "runtime_type": "mu-component",
      "sha256": "92aa8b24d906d0c40890c1cf7594d75e935f325d6f45e54d43092f3caca945e6",
      "slug": "mrn-active-style-guide",
      "source": {
        "git_commit": "60f7fa4e43a56e732cc68ea7e42ee91e92139d45",
        "path": "mu-plugins/mrn-active-style-guide",
        "repository": "MRN"
      },
      "version": "0.1.7"
    },
    {
      "deployed_path": "mu-plugins/mrn-active-style-guide.php",
      "file_count": 1,
      "name": "MRN Active Style Guide Loader",
      "required": true,
      "runtime_type": "mu-loader",
      "sha256": "57553c96f1e158a464da7d97ee1bf24298e6de236d010ffa6435485437a7cd23",
      "slug": "mrn-active-style-guide-loader",
      "source": {
        "git_commit": "60f7fa4e43a56e732cc68ea7e42ee91e92139d45",
        "path": "stack/mu-plugins/mrn-active-style-guide.php",
        "repository": "MRN"
      },
      "version": "0.1.7"
    },
    {
      "deployed_path": "mu-plugins/mrn-admin-data-post-types",
      "file_count": 3,
      "name": "MRN Admin Data Post Types",
      "required": true,
      "runtime_type": "mu-component",
      "sha256": "6a4baf4b1f1842f58904433fc85be40f4cd13da23dbfe36cc5b3a39222b1a623",
      "slug": "mrn-admin-data-post-types",
      "source": {
        "git_commit": "60f7fa4e43a56e732cc68ea7e42ee91e92139d45",
        "path": "mu-plugins/mrn-admin-data-post-types",
        "repository": "MRN"
      },
      "version": "0.2.1"
    },
    {
      "deployed_path": "mu-plugins/mrn-admin-data-post-types.php",
      "file_count": 1,
      "name": "MRN Admin Data Post Types Loader",
      "required": true,
      "runtime_type": "mu-loader",
      "sha256": "82c8fc7dc6ca42b0d9a1e68b6518da2c928e1e611740b2b10bcabbab60b9e718",
      "slug": "mrn-admin-data-post-types-loader",
      "source": {
        "git_commit": "60f7fa4e43a56e732cc68ea7e42ee91e92139d45",
        "path": "stack/mu-plugins/mrn-admin-data-post-types.php",
        "repository": "MRN"
      },
      "version": "0.2.1"
    },
    {
      "deployed_path": "mu-plugins/mrn-admin-ui-css",
      "file_count": 10,
      "name": "MRN Admin UI CSS",
      "required": true,
      "runtime_type": "mu-component",
      "sha256": "265baa398b0ef2432ab682c61fd0ec1ac4f93d8a6f9b8e510505f8248510d4a8",
      "slug": "mrn-admin-ui-css",
      "source": {
        "git_commit": "60f7fa4e43a56e732cc68ea7e42ee91e92139d45",
        "path": "mu-plugins/mrn-admin-ui-css",
        "repository": "MRN"
      },
      "version": "3.2.4"
    },
    {
      "deployed_path": "plugins/mrn-config-helper",
      "file_count": 28,
      "name": "MRN Config Helper",
      "required": true,
      "runtime_type": "standard-plugin",
      "sha256": "d6e5ae40ee1583e01e158c7d4d5bb75ae7e15cc5035221b26743b0c4ab484e17",
      "slug": "mrn-config-helper",
      "source": {
        "git_commit": "5f22f06acda7ea445b32f03d79fe8cf5061c03cc",
        "path": ".",
        "repository": "mrn-config-helper"
      },
      "version": "0.1.71"
    },
    {
      "deployed_path": "mu-plugins/mrn-dashboard-support",
      "file_count": 9,
      "name": "MRN Dashboard Support",
      "required": true,
      "runtime_type": "mu-component",
      "sha256": "fb494ac3d1cd98d2d17d3bda58bad43f4f60dea0f9ac12f2cfb7af7d718b675f",
      "slug": "mrn-dashboard-support",
      "source": {
        "git_commit": "60f7fa4e43a56e732cc68ea7e42ee91e92139d45",
        "path": "mu-plugins/mrn-dashboard-support",
        "repository": "MRN"
      },
      "version": "1.3.0"
    },
    {
      "deployed_path": "mu-plugins/mrn-disable-comments",
      "file_count": 7,
      "name": "MRN Disable Comments",
      "required": true,
      "runtime_type": "mu-component",
      "sha256": "3a53451169e864dce7828bf9f0b2d93274041b480625cbc5bd096e387fb6e3b7",
      "slug": "mrn-disable-comments",
      "source": {
        "git_commit": "60f7fa4e43a56e732cc68ea7e42ee91e92139d45",
        "path": "mu-plugins/mrn-disable-comments",
        "repository": "MRN"
      },
      "version": "1.2.5"
    },
    {
      "deployed_path": "mu-plugins/mrn-editor-lockdown",
      "file_count": 9,
      "name": "MRN Editor Lockdown",
      "required": true,
      "runtime_type": "mu-component",
      "sha256": "aa0f30d7076104e31f8798e5a5c6c383fc7f6b1f414295302c5760c82598a0f4",
      "slug": "mrn-editor-lockdown",
      "source": {
        "git_commit": "60f7fa4e43a56e732cc68ea7e42ee91e92139d45",
        "path": "mu-plugins/mrn-editor-lockdown",
        "repository": "MRN"
      },
      "version": "1.0.33"
    },
    {
      "deployed_path": "mu-plugins/mrn-editor-lockdown.php",
      "file_count": 1,
      "name": "MRN Editor Lockdown Loader",
      "required": true,
      "runtime_type": "mu-loader",
      "sha256": "dd8ebde554798d45f7048ecf10a7df59af8dcade4ab78470e32036ef5456dbaa",
      "slug": "mrn-editor-lockdown-loader",
      "source": {
        "git_commit": "60f7fa4e43a56e732cc68ea7e42ee91e92139d45",
        "path": "stack/mu-plugins/mrn-editor-lockdown.php",
        "repository": "MRN"
      },
      "version": "1.0.33"
    },
    {
      "deployed_path": "mu-plugins/mrn-environment-runtime",
      "file_count": 7,
      "name": "MRN Environment Runtime",
      "required": true,
      "runtime_type": "mu-component",
      "sha256": "754d7210a5b480cc777acabadaf1881c6459db30ed3fb9dc6f6abc8fe619724f",
      "slug": "mrn-environment-runtime",
      "source": {
        "git_commit": "60f7fa4e43a56e732cc68ea7e42ee91e92139d45",
        "path": "mu-plugins/mrn-environment-runtime",
        "repository": "MRN"
      },
      "version": "0.6.0"
    },
    {
      "deployed_path": "mu-plugins/mrn-environment-runtime.php",
      "file_count": 1,
      "name": "MRN Environment Runtime Loader",
      "required": true,
      "runtime_type": "mu-loader",
      "sha256": "75afe8a79a40e46bb59185d6aeddde66f82a6fa9ef3b5df9e8137d89142300d8",
      "slug": "mrn-environment-runtime-loader",
      "source": {
        "git_commit": "60f7fa4e43a56e732cc68ea7e42ee91e92139d45",
        "path": "stack/mu-plugins/mrn-environment-runtime.php",
        "repository": "MRN"
      },
      "version": "0.6.0"
    },
    {
      "deployed_path": "mu-plugins/mrn-loader.php",
      "file_count": 1,
      "name": "MRN Loader",
      "required": true,
      "runtime_type": "mu-loader",
      "sha256": "84016001a5e62476a21ba8fb3deada3060cd66f8c2a23992c8de289a8b5a6c8f",
      "slug": "mrn-loader",
      "source": {
        "git_commit": "60f7fa4e43a56e732cc68ea7e42ee91e92139d45",
        "path": "stack/mu-plugins/mrn-loader.php",
        "repository": "MRN"
      },
      "version": "1.6.1"
    },
    {
      "deployed_path": "plugins/mrn-media-bulk-tools",
      "file_count": 29,
      "name": "MRN Media Tools",
      "required": true,
      "runtime_type": "standard-plugin",
      "sha256": "b67657c2301e9217dbf3996aab9a001a5fb173d5daa2605dc0539633d715ca94",
      "slug": "mrn-media-bulk-tools",
      "source": {
        "git_commit": "7c303fb50b35d798ad1e00d3e98682af2158353a",
        "path": ".",
        "repository": "mrn-media-bulk-tools"
      },
      "version": "0.13.1"
    },
    {
      "deployed_path": "mu-plugins/mrn-public-security-hardening",
      "file_count": 14,
      "name": "MRN Public Security Hardening",
      "required": true,
      "runtime_type": "mu-component",
      "sha256": "2990992319e1bea4184a458a05267fd2ea712e260b589eed0b2b7fc19de0bc6c",
      "slug": "mrn-public-security-hardening",
      "source": {
        "git_commit": "60f7fa4e43a56e732cc68ea7e42ee91e92139d45",
        "path": "mu-plugins/mrn-public-security-hardening",
        "repository": "MRN"
      },
      "version": "0.4.3"
    },
    {
      "deployed_path": "mu-plugins/mrn-public-security-hardening.php",
      "file_count": 1,
      "name": "MRN Public Security Hardening Loader",
      "required": true,
      "runtime_type": "mu-loader",
      "sha256": "446b87463ad74ba8432bf20487a55890fa939cdb02f02de553790d34c5c99b6a",
      "slug": "mrn-public-security-hardening-loader",
      "source": {
        "git_commit": "60f7fa4e43a56e732cc68ea7e42ee91e92139d45",
        "path": "stack/mu-plugins/mrn-public-security-hardening.php",
        "repository": "MRN"
      },
      "version": "0.4.3"
    },
    {
      "deployed_path": "mu-plugins/mrn-schema-bridge",
      "file_count": 13,
      "name": "MRN Schema Bridge",
      "required": true,
      "runtime_type": "mu-component",
      "sha256": "ef964d39b70ac1804c83117958d166c1b2870194c1f38352ea1118583fe1938e",
      "slug": "mrn-schema-bridge",
      "source": {
        "git_commit": "e3998df38bdb230184ff793c9f6a13bb521dce0d",
        "path": ".",
        "repository": "mrn-schema-bridge"
      },
      "version": "0.7.0"
    },
    {
      "deployed_path": "mu-plugins/mrn-schema-bridge.php",
      "file_count": 1,
      "name": "MRN Schema Bridge Loader",
      "required": true,
      "runtime_type": "mu-loader",
      "sha256": "a8511b01840c43ab1f5a82e65da8c89016e74af706ed4d2d7228758805ba0621",
      "slug": "mrn-schema-bridge-loader",
      "source": {
        "git_commit": "60f7fa4e43a56e732cc68ea7e42ee91e92139d45",
        "path": "stack/mu-plugins/mrn-schema-bridge.php",
        "repository": "MRN"
      },
      "version": "0.7.0"
    },
    {
      "deployed_path": "mu-plugins/mrn-shared-assets",
      "file_count": 44,
      "name": "MRN Shared Assets",
      "required": true,
      "runtime_type": "mu-component",
      "sha256": "5ba9a6a4e1b91f418c3c634baf336154e86554b12b6a3759c4deb9b6ef7eb5b1",
      "slug": "mrn-shared-assets",
      "source": {
        "git_commit": "60f7fa4e43a56e732cc68ea7e42ee91e92139d45",
        "path": "mu-plugins/mrn-shared-assets",